{
  "$schema": "https://json-schema.org/draft-07/schema#",
  "title": "Game Version Entry",
  "description": "Metadata for a particular game version.",
  "type": "object",
  "properties": {
    "buildId": {
      "title": "Build ID",
      "description": "Steam build ID",
      "type": "integer"
    },
    "timeUpdated": {
      "title": "Time Updated",
      "type": "integer"
    },
    "gameVersion": {
      "title": "Game Version",
      "$ref": "semver.schema.json"
    },
    "depots": {
      "title": "Version Depot Metadata Mapping",
      "description": "Entries that provide distribution depot metadata for this game version",
      "type": "array",
      "items": {
        "title": "Version Depot Metadata Entry",
        "type": "object",
        "properties": {
          "depotId": {
            "title": "Steam Depot ID",
            "type": "integer"
          },
          "manifestId": {
            "title": "Steam Manifest ID",
            "description": "Manifest ID of the depot's contents on the 'public' branch for this game version",
            "type": "integer"
          }
        },
        "required": ["depotId", "manifestId"]
      }
    },
    "frameworkTargets": {
      "title": "Framework targets",
      "description": "Entries that map NuGet package Target Framework Moniker to package dependencies under that framework.",
      "type": "array",
      "items": {
        "title": "Framework target",
        "description": "Entry associating a TFM with some NuGet package dependencies.",
        "type": "object",
        "properties": {
          "tfm": {
            "title": "Target Framework Moniker",
            "$ref": "dotnet-target-framework-moniker.schema.json"
          },
          "dependencies": {
            "title": "Dependencies",
            "description": "List of NuGet package dependency specifiers",
            "type": "array",
            "items": {
              "title": "NuGet dependency",
              "description": "NuGet package dependency specifier",
              "type": "object",
              "properties": {
                "name": {
                  "title": "Name",
                  "description": "NuGet package dependency package name",
                  "type": "string"
                },
                "version": {
                  "title": "Version",
                  "$ref": "semver.schema.json"
                }
              },
              "required": [ "name", "version" ]
            }
          }
        },
        "required": [ "tfm", "dependencies" ]
      },
      "minItems": 1
    }
  },
  "required": [ "buildId", "gameVersion", "timeUpdated", "depots", "frameworkTargets" ]
}