{
  "buildId": 13021605,
  "timeUpdated": 1703172315,
  "gameVersion": "0.10.28-r21014",
  "depots": [
    {
      "depotId": 1366541,
      "manifestId": 3700818433573659132
    }
  ],
  "frameworkTargets": [
    {
      "tfm": "netstandard2.0",
      "dependencies": [
        {
          "name": "UnityEngine.Modules",
          "version": "2018.4.12"
        }
      ]
    }
  ]
}