{
  "buildId": 12922815,
  "timeUpdated": 1702209853,
  "gameVersion": "45.0.2",
  "depots": [
    {
      "depotId": 1966721,
      "manifestId": 7637156099460715726
    }
  ],
  "frameworkTargets": [
    {
      "tfm": "netstandard2.0",
      "dependencies": [
        {
          "name": "UnityEngine.Modules",
          "version": "2022.3.9"
        },
        {
          "name": "Newtonsoft.JSON",
          "version": "13.0.3"
        }
      ]
    }
  ]
}