{
  "buildId": 16750464,
  "timeUpdated": 1734264100,
  "gameVersion": "",
  "depots": [
    {
      "depotId": 2881651,
      "manifestId": 4763499704581700907
    }
  ],
  "frameworkTargets": [
    {
      "tfm": "netstandard2.1",
      "dependencies": [
        {
          "name": "UnityEngine.Modules",
          "version": "2022.3.10"
        },
        {
          "name": "Newtonsoft.JSON",
          "version": "13.0.3"
        },
        {
          "name": "WebSocketSharp",
          "version": "1.0.3-rc11"
        }
      ]
    }
  ]
}